,title,description,originallink,link,pubDate
0,"제이홉, 폭우 피해에 1억원 기부","이번 폭우 피해로 배우 김혜수가 1억원을 기부한데 방송인 유재석, 가수 <b>싸이</b>(본명 박재상), 가수 아이유와 수지가 각각 1억원을 기부했으며 배우 김고은, 한지민이 5000만원을 기부했다.",http://star.mk.co.kr/new/view.php?mc=ST&year=2022&no=730011,https://n.news.naver.com/mnews/article/009/0005005817?sid=106,"Thu, 18 Aug 2022 10:18:00 +0900"
1,"'악동도 깜짝 놀란 풍채'.. 카사노, ""김민재 엄청 커, 덤비지마""",뒤지지 않는 외모에서부터 밀리지 않은 풍모를 지녀 인기를 끌었다. 여기에 나폴리 선수단 신고식에서 <b>싸이</b>의 &apos;강남스타일&apos;을 부르며 춘 춤 때문에 열정 넘치는 나폴리 팬들의 시선을 한몸에 사로 잡았다. ,http://www.osen.co.kr/article/G1111921527,https://sports.news.naver.com/news.nhn?oid=109&aid=0004680479,"Thu, 18 Aug 2022 10:11:00 +0900"
2,최초의 기후위기 외교관 최후의 대안을 내놓다,<b>싸이</b> 열풍의 상징인 강남역에서는 외국인 관광객이 유모차를 들고 42개 계단을 올라가는 걸 직접 봤어요. 광화문역에는 155개짜리 계단이 있어요. 반면 도쿄는 완벽해요. 공항에서 호텔 입구까지 트렁크 끌고 갈 수... ,https://www.sisain.co.kr/news/articleView.html?idxno=48245,https://n.news.naver.com/mnews/article/308/0000031337?sid=102,"Thu, 18 Aug 2022 05:56:00 +0900"
3,'싸이·경주용 전기차' 뜨니 7.6만명 서울 잠실로..내년엔 '광화문',"&apos;서울페스타&apos; 서울관광 부활 신호탄 앞서 개막식에선 <b>싸이</b>와 엔씨티드림, 스트레이키즈 등 케이팝(K팝)을 대표하는 스타들이 총출동했다. 외국인 관광객을 포함해 K팝을 좋아하는 시민들도 한곳에 모였다. 공연장... ",http://news.mt.co.kr/mtview.php?no=2022081709535711137,https://n.news.naver.com/mnews/article/008/0004784234?sid=102,"Thu, 18 Aug 2022 05:20:00 +0900"
4,머니투데이 오프라인 헤드라인-18일,"[정책사회·문화] <b>싸이</b> 뛰고, 전기차 폭풍 레이스…&apos;8만명&apos; 몰린 잠실 &apos;MZ 공무원&apos; 다 떠날라...원격·자율근무 늘린다 [스타뉴스] &apos;우영우&apos; 신드롬 시즌2로 이어갈까? 아홉남자의 &apos;대시&apos;, 더 짙어진 팀 색깔 &quot;스크린·안방... ",http://news.mt.co.kr/mtview.php?no=2022081721070160520,https://n.news.naver.com/mnews/article/008/0004784223?sid=101,"Thu, 18 Aug 2022 04:00:00 +0900"
5,[조세린 클라크의 문화산책] 물을 다스리는 지도자,"얼음과 숲으로 둘러싸인 주노(Juneau)시의 동쪽으로는 거대한 빙원, 서쪽으로는 해안이 있고 나무는 어디에나... 서울 강남의 브랜드는 이번에 <b>싸이</b>의 말춤에서 제네시스 차량 위에 정장 차림으로 앉아 홍수 장면을 찍어... ",https://www.joongang.co.kr/article/25095118,https://n.news.naver.com/mnews/article/025/0003217423?sid=110,"Thu, 18 Aug 2022 00:35:00 +0900"
6,[김호광 칼럼] P2E에서 클레이튼의 가능성과 리스크,메타버스와 NFT를 위한 블록체인 메인넷인 <b>싸이</b>메타버스체인은 클레이튼보다 더 저렴한 수수료와 3초 이내의 전송 속도를 자랑한다. P2E를 위한 개발자용 SDK를 준비 중에 있어서 기존의 게임 회사들이 P2E로 전환을 쉽게... ,https://www.gametoc.co.kr/news/articleView.html?idxno=67767,https://www.gametoc.co.kr/news/articleView.html?idxno=67767,"Wed, 17 Aug 2022 18:44:00 +0900"
7,느슨해진 방역의식 다시 조여야할 때,실제로 지난 6일 여수에서 열린 가수 <b>싸이</b>의 ‘흠뻑쇼’ 공연에는 지역 각지에서 3만 명의 관객이 운집했다. 이 페스티벌은 수많은 관객들이 서로 밀접한 채 소리를 지르면서 비말이 쉽게 튀고 마스크가 물에 젖기 때문에... ,http://www.jndn.com/article.php?aid=1660727998342855059,http://www.jndn.com/article.php?aid=1660727998342855059,"Wed, 17 Aug 2022 18:22:00 +0900"
8,"“이런 날이 올 줄이야”…싸이월드 장악했던 얼짱, 축하받을 소식 알렸다 (전...","이를 본 누리꾼들은 “언니 감성이 담긴 패션 너무 좋아요”, “와 진심으로 축하드립니다”, “빨리 만날 수 있었으면 좋겠어요” 등 뜨거운 반응을 보였다.유보화는 2000년대 중반 <b>싸이</b>월드에서 얼짱으로 이름을 알린 뒤... ",https://www.wikitree.co.kr/articles/781317,https://www.wikitree.co.kr/articles/781317,"Wed, 17 Aug 2022 18:02:00 +0900"
9,3년 만에 돌아온 '제5회 전주모래내시장 치맥&가맥 페스티벌'… 19~20일 개최,이어 20일에는 ▲가수 천명훈(NRG) ▲히든싱어 <b>싸이</b> ▲최나리 ▲더블루이어즈 ▲놀면 뭐하니? ▲치맥 마이크 ▲스트릿 댄스파이터 등의 다양한 축하 무대 공연과 고객참여 프로그램이 시장 곳곳에서 펼쳐진다. 이와... ,http://www.bizwnews.com/news/articleView.html?idxno=40327,http://www.bizwnews.com/news/articleView.html?idxno=40327,"Wed, 17 Aug 2022 17:56:00 +0900"
10,"전주모래내시장 '제5회 치맥&가맥 페스티벌' 19일, 20일 개최","이번 모래내시장 치맥&amp;가맥 페스티벌은 19일에는 식전공연, 개막축하 특집 공개방송(가수 김상배, 정혜린, 설하수,김리아, 오원화, 김상기), 20일에는 가수 천명훈(NRG), 히든싱어 <b>싸이</b>, 최나리, 더블루이어즈, 놀면 뭐하니?... ",https://www.dailysecu.com/news/articleView.html?idxno=139069,https://www.dailysecu.com/news/articleView.html?idxno=139069,"Wed, 17 Aug 2022 17:34:00 +0900"
11,싸이월드 다이어리가 되살아난다,"지난 4월 <b>싸이</b>월드 사진첩이 복구되면서 ‘판도라의 상자’가 열렸습니다. 절대 과거를 마주하지 않겠다며 <b>싸이</b>월드를 탈퇴한 사람이 있는가 하면, 그 시절을 추억하며 인스타그램 등에 옛날 사진을 올리는 이들도... ",https://www.vogue.co.kr/2022/08/17/%ec%8b%b8%ec%9d%b4%ec%9b%94%eb%93%9c-%eb%8b%a4%ec%9d%b4%ec%96%b4%eb%a6%ac%ea%b0%80-%eb%90%98%ec%82%b4%ec%95%84%eb%82%9c%eb%8b%a4/?utm_source=naver&utm_medium=partnership,https://www.vogue.co.kr/2022/08/17/%ec%8b%b8%ec%9d%b4%ec%9b%94%eb%93%9c-%eb%8b%a4%ec%9d%b4%ec%96%b4%eb%a6%ac%ea%b0%80-%eb%90%98%ec%82%b4%ec%95%84%eb%82%9c%eb%8b%a4/?utm_source=naver&utm_medium=partnership,"Wed, 17 Aug 2022 17:00:00 +0900"
12,"류승수, 레전드 짤 후폭풍 호소...""돈 없고 더 유명해져""('라스')",17일 MBC 예능프로그램 &apos;라디오스타&apos;(이하 &apos;라스&apos;)는 네이버TV에 &quot;<b>싸이</b>의 마음을 한 방에 훔친 현아의 마카레나 춤?!&quot;라는 제목의 선공개 영상을 게재했다. 류승수가 3년 만에 &apos;라스&apos;에 출연해 화제의 &apos;레전드 짤&apos; 후폭풍을... ,http://star.mk.co.kr/new/view.php?mc=ST&year=2022&no=728115,https://n.news.naver.com/mnews/article/009/0005005507?sid=106,"Wed, 17 Aug 2022 16:06:00 +0900"
13,"싸이 '흠뻑쇼' 끝나자 인조잔디 폭삭, 여수시 ""복구 요청""",뉴스토마토 = 박재연 기자 | 17일 오후 서울 송파구 잠실 올림픽주경기장에서 열리는 가수 <b>싸이</b>의 콘서트 &apos;<b>싸이</b>흠뻑쇼 2022&apos;를 찾은 관객들이 입장을 기다리고 있다. 2022.7.17 가수 <b>싸이</b>의 &apos;흠뻑쇼&apos;가 여수에서 진행된 가운데... ,http://www.newstomato.com/ReadNews.aspx?no=1141538&inflow=N,http://www.newstomato.com/ReadNews.aspx?no=1141538&inflow=N,"Wed, 17 Aug 2022 16:02:00 +0900"
14,"임영웅, 광고주가 사랑하는 트로트 스타 1위","박서준, <b>싸이</b> 순으로 분석됐다. 임영웅은 올해 데뷔 첫 전국투어 콘서트를 통해 7개 도시 21회차 17만여명의 관객들과 함께했다. 전회차 전석 매진되며 임영웅의 인기를 실감케 했다. 티빙을 통해 생중계한 14일 서울... ",https://www.ekn.kr/web/view.php?key=20220817001533511,https://www.ekn.kr/web/view.php?key=20220817001533511,"Wed, 17 Aug 2022 15:36:00 +0900"
15,"'TOP' 임영웅, 유튜브뮤직 최근 28일 조회수 1위","세븐틴(2100만 뷰), 8위 ITZY(2000만 뷰), 9위 (여자)아이들(1990만 뷰), 10위 <b>싸이</b>(1780만 뷰) 순이었다. 임영웅은 글로벌 인기 아이돌그룹, 음원 강자 속 수위에 오르며 가요계 최고 대세 존재감을 또 한 번 확실히 했다.",http://star.mt.co.kr/stview.php?no=2022081709432461930,https://n.news.naver.com/mnews/article/108/0003079520?sid=106,"Wed, 17 Aug 2022 14:50:00 +0900"
16,"국뽕 대신 현실, 전문가들이 바라본 한식 산업의 현 주소",김숙진 그룹장은 &apos;강남스타일&apos;로 큰 인기를 끌었던 가수 <b>싸이</b>를 모델로 기용했던 일화를 소개하며 &quot;K팝 스타 마케팅은 브랜드 인지도를 높이고 제품 1차구매에는 분명히 도움이 된다. 하지만 반복구매를 위해서는 제품력이... ,http://www.ohmynews.com/NWS_Web/View/at_pg.aspx?CNTN_CD=A0002858050&CMPT_CD=P0010&utm_source=naver&utm_medium=newsearch&utm_campaign=naver_news,https://n.news.naver.com/mnews/article/047/0002363204?sid=106,"Wed, 17 Aug 2022 14:05:00 +0900"
17,"아산시, 코로나19 확산세에 대규모 물총 축제 개최 논란",실제 지난 6일 전남 여수에서 진행된 가수 <b>싸이</b>의 ‘흠뻑쇼’에 다녀온 참여자 중 77명이 코로나19에 확진된 것으로 드러나 방역당국이 참여자 전원에게 코로나19 검사를 권고하는 등 대규모로 물을 이용한 축제에 대한... ,http://news.tf.co.kr/read/national/1959052.htm,https://n.news.naver.com/mnews/article/629/0000167278?sid=102,"Wed, 17 Aug 2022 13:39:00 +0900"
18,"논란 끊이지 않는 싸이 '흠뻑쇼'...여수시 ""공연장 바닥재·인조잔디 훼손돼 ...",사진=피네이션 전남 여수에서 개최된 가수 <b>싸이</b>의 단독 콘서트 &apos;흠뻑쇼&apos;로 인해 공연장 내 일부 시설물이... 지난 6일 여수시 진남종합운동장에서는 약 3만명이 운집한 가운데 <b>싸이</b>의 &apos;흠뻑쇼&apos; 공연이 열렸다. 여수시는... ,http://www.newsinside.kr/news/articleView.html?idxno=1140449,http://www.newsinside.kr/news/articleView.html?idxno=1140449,"Wed, 17 Aug 2022 11:54:00 +0900"
19,"식품업계, '과도한 베끼기'…미투 마케팅 이대로 좋은가",맘스터치가 2005년 선보인 <b>싸이</b>버거는 17년간 4억개 이상 팔린 초인기 제품이다. <b>싸이</b>버거는 4300원이라는 저렴한 가격으로 버거킹 와퍼(6900원)나 맥도날드 빅맥(4600원) 등 경쟁사 간판제품보다 한결 저렴하면서도 푸짐한... ,http://www.newsis.com/view/?id=NISX20220817_0001980493&cID=13001&pID=13000,https://n.news.naver.com/mnews/article/003/0011367346?sid=101,"Wed, 17 Aug 2022 11:47:00 +0900"
20,"방탄소년단 RM, 태어난 지 10200일 '최애돌' 기부요정","<b>싸이</b>와 엔시티드림, 강다니엘, TXT, 더보이즈, 아이브, 르세라핌, 있지, 오마이걸, 프로미스나인, 비비지, 유주, 케플러, SF9, 펜타곤, 포레스텔라, 드림캐쳐, 골든차일드, 에이비식스, 알렉사, 헤이즈, TNX, 블리처스... ",http://star.mt.co.kr/stview.php?no=2022081711075987605,https://n.news.naver.com/mnews/article/108/0003079460?sid=106,"Wed, 17 Aug 2022 11:10:00 +0900"
21,"방탄소년단 RM, 태어난 지 10200일 기념 '최애돌' 기부요정","<b>싸이</b>와 엔시티드림, 강다니엘, TXT, 더보이즈, 아이브, 르세라핌, 있지, 오마이걸, 프로미스나인, 비비지, 유주, 케플러, SF9, 펜타곤, 포레스텔라, 드림캐쳐, 골든차일드, 에이비식스, 알렉사, 헤이즈, TNX, 블리처스... ",http://www.stoo.com/article.php?aid=82023443411,http://www.stoo.com/article.php?aid=82023443411,"Wed, 17 Aug 2022 10:52:00 +0900"
22,"방탄소년단 RM, 기부요정 등극…탄생 10200일 맞아 팬덤 아미 화력 폭발","<b>싸이</b>와 엔시티드림, 강다니엘, TXT, 더보이즈, 아이브, 르세라핌, 있지, 오마이걸, 프로미스나인, 비비지, 유주, 케플러, SF9, 펜타곤, 포레스텔라, 드림캐쳐, 골든차일드, 에이비식스, 알렉사, 헤이즈, TNX... ",http://www.mediapen.com/news/view/747059,http://www.mediapen.com/news/view/747059,"Wed, 17 Aug 2022 10:52:00 +0900"
23,"반기보고서 제출 마감, 부적정·자본잠식 상장사 속출","<b>싸이</b>월드 테마주로 이름을 알리며 투자자들의 관심을 받았던 인트로메딕을 포함해 엔지스테크놀러지, 연이비앤티, 한국코퍼레이션, 디에스앤엘, 베스파, UCI, ITX-AI, 소리바다, 엘아이에스, 레드로버, 좋은사람들... ",http://www.newsis.com/view/?id=NISX20220817_0001980801&cID=10403&pID=15000,https://n.news.naver.com/mnews/article/003/0011367035?sid=101,"Wed, 17 Aug 2022 10:39:00 +0900"
24,"방탄소년단 RM, 태어난지 10200일 맞아 '최애돌' 제367대 기부요정","<b>싸이</b>와 엔시티드림, 강다니엘, TXT, 더보이즈, 아이브, 르세라핌, 있지, 오마이걸, 프로미스나인, 비비지, 유주, 케플러, SF9, 펜타곤, 포레스텔라, 드림캐쳐, 골든차일드, 에이비식스, 알렉사, 헤이즈, TNX, 블리처스... ",http://www.celuvmedia.com/article.php?aid=1660699407432909007,http://www.celuvmedia.com/article.php?aid=1660699407432909007,"Wed, 17 Aug 2022 10:34:00 +0900"
25,[Y이슈] 민폐의 아이콘 된 '흠뻑쇼'…공연업계 된서리 맞을까,"가수 <b>싸이</b> 씨의 단독 콘서트 &apos;<b>싸이</b> 흠뻑쇼 2022&apos;(이하 흠뻑쇼)를 둘러싼 잡음이 두 달 째 이어지고 있다. 공연장 시설물 훼손, 코로나19 확산 등 다양한 논란을 양산하며 민폐의 아이콘으로 전락했다. 먼저 지난 6일 전남... ",https://star.ytn.co.kr/_sn/0117_202208171023280526,https://n.news.naver.com/mnews/article/052/0001777712?sid=106,"Wed, 17 Aug 2022 10:23:00 +0900"
26,불닭면 인기에 깜짝 실적...삼양 부회장 “BTS 지민 효과”,"김숙진 그룹장은 가수 <b>싸이</b>를 모델로 쓴 적이 있다며 “브랜드 인지도, 1차 구매에 충분히 효과가 있다고... &apos;강남스타일&apos;로 일찍이 빌보드 차트에 이름을 올리고 전 세계에 한국을 알린 <b>싸이</b>가 K-푸드 홍보에도 톡톡히... ",http://news.mk.co.kr/newsRead.php?no=725958&year=2022,https://n.news.naver.com/mnews/article/009/0005005304?sid=101,"Wed, 17 Aug 2022 10:15:00 +0900"
27,탈 많은 싸이 ‘흠뻑쇼’…이번엔 “공연장 인조잔디 폭삭”,"물 낭비 지적부터 노동자 추락사, 코로나19 방역 우려까지 잇단 논란에 휩싸였던 가수 <b>싸이</b>의 ‘흠뻑쇼’ 콘서트가 이번에는 공연장 바닥 훼손으로 지방자치단체의 원상복구 요구를 받았다. 전남 여수시는 <b>싸이</b>... ",https://news.kmib.co.kr/article/view.asp?arcid=0017379868&code=61171811&cp=nv,https://n.news.naver.com/mnews/article/005/0001546947?sid=103,"Wed, 17 Aug 2022 09:42:00 +0900"
28,싸이월드 내달 1일 ‘다이어리’ 서비스 오픈… 글 11억건 복원," <b>싸이</b>월드가 내달 1일 다이어리 기능을 오픈하고, 과거 적었던 다이어리 글 11억건을 복원해 각자에게 공개한다. 16일 <b>싸이</b>월드에 따르면, 복원된 다이어리는 ‘추억’이라는 타이틀로 기존 유저가 가지고 있던... ",https://hobbyen.co.kr/news/newsview.php?ncode=1065597654016766,https://hobbyen.co.kr/news/newsview.php?ncode=1065597654016766,"Wed, 17 Aug 2022 09:40:00 +0900"
29,"NBN TV, 디지털자산 전문가 ‘자문위원단 위촉’","이밖에 업계에서는 △강성후 KDA 회장 △김동환 블리츠랩스 이사 △김태훈 ㈜<b>싸이</b>월드제트 대표이사 △이해붕 업비트 투자자보호센터장 △서병윤 빗썸 경제연구소장을, 언론계에서는 △이상훈 한국정경신문 IT과학부... ",http://www.mediapen.com/news/view/747010,http://www.mediapen.com/news/view/747010,"Wed, 17 Aug 2022 09:34:00 +0900"
30,"NBN TV, 디지털자산 전문가들과 '자문위원단 위촉식' 진행","이사 △김태훈 <b>싸이</b>월드제트 대표이사 △이해붕 업비트 투자자보호센터장 △서병윤 빗썸 경제연구소장, 언론계에서는 △이상훈 한국정경신문 IT과학부 부장 △이수호 테크엠 부사장이 자문위원으로... ",http://www.m-i.kr/news/articleView.html?idxno=942887,http://www.m-i.kr/news/articleView.html?idxno=942887,"Wed, 17 Aug 2022 09:32:00 +0900"
31,"[뉴스딱] 싸이 흠뻑쇼 또 시끌…""공연 후 인조잔디 폭삭, 복구하라""","<b>싸이</b> 씨의 콘서트가 꾸준히 논란에 휩<b>싸이</b>고 있는데, 이번에는 시설물 훼손 논란입니다. 전남 여수시는 <b>싸이</b> 콘서트 주관업체 측에 최근 공연장 시설물 훼손에 따른 원상복구 공문을 보냈다고 밝혔습니다. 해당 공연은... ",https://news.sbs.co.kr/news/endPage.do?news_id=N1006862555&plink=ORI&cooper=NAVER,https://n.news.naver.com/mnews/article/055/0000993352?sid=102,"Wed, 17 Aug 2022 09:16:00 +0900"
32,美 음악시장에 녹아들다…빌보드 장악한 K팝,<b>싸이</b> &apos;강남스타일&apos;이 K팝의 존재를 알렸다면 방탄소년단은 서구권에 제대로 된 소통창구(팬덤)를 만들면서 진출 도로를 깔았다. 이를 바탕으로 4세대 아이돌까지 최대 음악 전문 매체 빌보드를 차례로 점령해... ,http://www.newspim.com/news/view/20220816000788,http://www.newspim.com/news/view/20220816000788,"Wed, 17 Aug 2022 08:51:00 +0900"
33,"'싸이 흠뻑쇼' 공연장 훼손…여수시, 원상복구 요구",여수에서 열린 가수 <b>싸이</b>의 &apos;흠뻑쇼&apos; 공연으로 일부 시설물이 훼손돼 여수시가 주관업체에 원상복구를... 지난 6일 여수진남경기장에서 열린 &apos;<b>싸이</b> 흠뻑쇼&apos;에는 관람객 3만여명이 몰리면서 주변에 큰 교통혼잡이 이어졌고... ,http://www.ikbc.co.kr/article/view/kbc202208170016,https://n.news.naver.com/mnews/article/660/0000015068?sid=102,"Wed, 17 Aug 2022 08:38:00 +0900"
34,"김정수 부회장 “BTS 지민, 불닭면 즐겨먹어 광고효과 톡톡” (식자회담)[결정...","제일제당 김숙진 그룹장은 “<b>싸이</b>를 모델로 쓴 적이 있다. 브랜드 인지도, 1차 구매에 충분히 효과가 있다고 생각한다. 반복 구매가 일어나기 위해서는 제품력이 받쳐줘야 시장이 커지고 브랜드에 대한 로열티가... ",https://www.newsen.com/news_view.php?uid=202208170615341710,https://n.news.naver.com/mnews/article/609/0000616063?sid=106,"Wed, 17 Aug 2022 06:17:00 +0900"
35,"아이유·임영웅→BTS, '공연의 神'들의 신기록 행진[SS연예프리즘]",지금까지 잠실올림픽주경기장에서 공연을 한 가수는 1999년 H.O.T를 시작으로 god·조용필·신화·이승환·이승철·JYJ·이문세·서태지·엑소·방탄소년단·<b>싸이</b>가 있다. NCT DREAM은 지난달 29일∼31일 서울 고척스카이돔에서... ,http://www.sportsseoul.com/news/read/1151152?ref=naver,https://n.news.naver.com/mnews/article/468/0000874191?sid=106,"Wed, 17 Aug 2022 06:01:00 +0900"
36,"싸이 '흠뻑쇼' 지나간 후 인조잔디 '폭삭'… 여수시, 원상복구 요구",열흘 전 전라남도 여수에서 열린 가수 <b>싸이</b>의 &apos;흠뻑쇼&apos; 공연 이후 공연장 내 일부 시설물이 훼손돼 여수시가 주관 업체 측에 원상복구를 요구했다. 여수시는 <b>싸이</b> &apos;흠뻑쇼&apos; 공연 주관 업체인 &apos;공연마루&apos;에 최근 공연장... ,http://www.fnnews.com/news/202208162217202458,https://n.news.naver.com/mnews/article/014/0004884059?sid=102,"Wed, 17 Aug 2022 04:06:00 +0900"
37,"""싸이 '흠뻑쇼'에 인조잔디 폭삭""…여수시, 원상복구 요구",전남 여수시가 가수 <b>싸이</b>의 ‘흠뻑쇼’ 공연 이후 공연장 내 일부 시설물이 훼손됐다며 주관 업체 측에 원상복구를 요구했다. 3일 오후 서울 송파구 잠실종합운동장 보조경기장에서 열린 ‘<b>싸이</b> 흠뻑쇼 서머 스웨그 2018’... ,http://www.edaily.co.kr/news/newspath.asp?newsid=05477606632427976,https://n.news.naver.com/mnews/article/018/0005293685?sid=102,"Tue, 16 Aug 2022 21:16:00 +0900"
38,77명 확진 '싸이 흠뻑쇼’…공연장 인조 잔디 '폭삭' 논란,여수시가 가수 <b>싸이</b>의 ‘흠뻑쇼’ 공연 이후 공연장 내 일부 시설물이 훼손됐다며 주관 업체 측에 원상복구를 요청했다. 여수시는 16일 <b>싸이</b> ‘흠뻑쇼’ 공연 주관 업체인 ‘공연마루’에 최근 공연장 시설물 훼손에 따른... ,https://www.sedaily.com/NewsView/269TKTCXZI,https://n.news.naver.com/mnews/article/011/0004088206?sid=102,"Tue, 16 Aug 2022 21:14:00 +0900"
39,[여기는 전남] ‘콘서트 뒤 훼손’ 진남경기장 내일 현장조사 외,"가수 <b>싸이</b>의 콘서트 이후 바닥이 훼손된 여수 진남종합운동장 시설 원상 복구를 위한 사전 현장 조사가 진행됩니다. 현장 조사에는 지난 6일 콘서트를 주관한 업체 측과 여수시, 공사 전문가가 참여해 탄성바닥재와... ",https://news.kbs.co.kr/news/view.do?ncd=5534195&amp;ref=A,https://n.news.naver.com/mnews/article/056/0011321750?sid=102,"Tue, 16 Aug 2022 19:30:00 +0900"
40,"싸이 '흠뻑쇼' 끝나자 인조잔디 폭삭…여수시, 원상복구 요구",전남 여수에서 가수 <b>싸이</b>의 &apos;흠뻑쇼&apos; 공연이 열린 이후 인조잔디가 가라앉는 등 일부 시설물이 훼손된 것으로 나타난 가운데 여수시가 원상복구를 요구했다. 16일 여수시는 <b>싸이</b> &apos;흠뻑쇼&apos; 공연 주관 업체인 &apos;공연마루&apos;에... ,https://www.dailian.co.kr/news/view/1143177/?sc=Naver,https://n.news.naver.com/mnews/article/119/0002630731?sid=102,"Tue, 16 Aug 2022 18:48:00 +0900"
41,"여수시, '싸이 흠뻑쇼'로 훼손된 바닥재·인조잔디 복구 요청",지난달 17일 오후 서울 송파구 잠실동 잠실종합운동장에서 가수 <b>싸이</b>의 콘서트 &apos;흠뻑쇼 2022&apos;가 진행되고 있다. [연합뉴스]  전남 여수시가 가수 <b>싸이</b>의 콘서트로 인해 시설물이 훼손됐다며 원상복구를 요청했다. 16일... ,https://www.ziksir.com/news/articleView.html?idxno=29140,https://www.ziksir.com/news/articleView.html?idxno=29140,"Tue, 16 Aug 2022 18:04:00 +0900"
42,"대형 햄버거 프랜차이즈, 올해만 두번째 가격 인상…'버거플레이션' 현실화",2월 가격 인상 당시 대표 메뉴인 <b>싸이</b>버거를 비롯한 버거류를 포함해 총 37종 제품의 가격을 올렸으며... 지난 2월 가격 인상 전까지 3800원이었던 <b>싸이</b>버거는 4100원으로 오른 후 이달 초부터 4300원에 판매된다.... ,http://www.opinionnews.co.kr/news/articleView.html?idxno=71980,http://www.opinionnews.co.kr/news/articleView.html?idxno=71980,"Tue, 16 Aug 2022 18:00:00 +0900"
43,"싸이 '흠뻑쇼' 연이은 불협화음…여수시 ""인조잔디 원상복구 하라""",전남 여수시가 <b>싸이</b>의 &apos;흠뻑쇼&apos; 공연 이후 공연장 내 일부 시설물이 훼손된 것에 대해 주관 업체 측에... 앞서 시는 <b>싸이</b> &apos;흠뻑쇼&apos; 공연에 몰릴 인파에 대비해 3만 명이 운집할 것으로 예상하고 종합 안전대책을 마련하고... ,http://mbn.mk.co.kr/pages/news/newsView.php?category=mbn00012&news_seq_no=4824801,https://n.news.naver.com/mnews/article/057/0001683891?sid=106,"Tue, 16 Aug 2022 17:59:00 +0900"
44,11억건의 싸이월드 다이어리 복구된다...다음달 1일 공개,▲ 사진=<b>싸이</b>월드 공식 홈페이지 캡쳐 16일 <b>싸이</b>월드가 다음 달 1일 ‘다이어리’ 기능을 재개한다고 밝혔다. 과거 이용자들이 다이어리에 남긴 11억건의 글이 모두 복원될 예정이다. <b>싸이</b>월드는 지난해 에프엑스기어와... ,https://www.thedrive.co.kr/news/newsview.php?ncode=1065602585168640,https://www.thedrive.co.kr/news/newsview.php?ncode=1065602585168640,"Tue, 16 Aug 2022 17:54:00 +0900"
45,싸이 흠뻑쇼 후 인조잔디 폭삭…여수시 원상복구 요구,여수시가 가수 <b>싸이</b>의 ‘흠뻑쇼’ 공연 후 공연장 시설물이 일부 훼손됐다며 주관 업체 측에 원상복구를 요구했다. 16일 여수시는 <b>싸이</b> ‘흠뻑쇼’ 공연 주관 업체인 ‘공연마루’에 최근 공연장 시설물 훼손에 따른... ,https://www.chosun.com/national/national_general/2022/08/16/XRNT3TRJMFFFDFJLCWV22XIWHY/?utm_source=naver&utm_medium=referral&utm_campaign=naver-news,https://n.news.naver.com/mnews/article/023/0003710238?sid=102,"Tue, 16 Aug 2022 17:53:00 +0900"
46,[김진영의 사진집 이야기 티안 돈 나 참파삭의 ‘팝 댄스의 아버지(The Fathe...,"사진 김진영 인스타그램과 페이스북이 있기 전, 그보다 더 거슬러 올라가 <b>싸이</b>월드가 있기 전 우리에게는 사진 앨범이 있었다. 집집마다 보관하는 사진 앨범에는 사적인 기록이 담겨 있다. 불특정 다수의 사람이 볼 수... ",http://economychosun.com/client/news/view.php?boardName=C26&t_num=13613265,http://economychosun.com/client/news/view.php?boardName=C26&t_num=13613265,"Tue, 16 Aug 2022 17:52:00 +0900"
