,title,description,originallink,link,pubDate
237,"프로야구 대표 미남과 개그 캐릭터, 유튜버로 깜짝 변신","K-pop 댄스 클래스를 통해 <b>싸이</b>의 ‘That That’ 안무를 배우고, 쿠킹클래스에서는 생전 처음 프랑스 고급 요리에 도전해 숨겨왔던 요리 실력을 보여줬다. 쓰레기를 주우며 등산을 하는 ‘플로깅’에 도전해 MZ세대의... ",http://www.osen.co.kr/article/G1111918178,https://sports.news.naver.com/news.nhn?oid=109&aid=0004677449,"Fri, 12 Aug 2022 19:07:00 +0900"
238,"싸이·유재석·아이유…수해 성금 1억 기부, 발 벗고 나선 '기부천사'들 [이슈...","배우 김혜수를 시작으로 <b>싸이</b>, 유재석, 수지, 아이유, 박재범, 이성경 등이 수해 지역 복구와 이재민 구호... 가수 겸 프로듀서 <b>싸이</b> 역시 지난 11일 대한적십자사를 통해 1억 원을 기부했다. 이와 함께 그는 &quot;갑작스러운... ",https://www.hankyung.com/entertainment/article/202208120900H,https://n.news.naver.com/mnews/article/015/0004736563?sid=106,"Fri, 12 Aug 2022 19:00:00 +0900"
239,"이성경, 수해복구 위해 1억 쾌척…나흘째 ★들 기부행렬 귀감[종합]","가수 <b>싸이</b>는 대한적십자사에 1억 원을 기부했다. 12일에도 스타들의 기부가 이어졌다. 배우 수지는 1억 원, 가수 겸 배우 아이유는 1억 원, 가수 박재범은 1억 원, 배우 이성경은 1억 원, 그룹 러블리즈 출신 이미주는... ",https://www.newsen.com/news_view.php?uid=202208121807540410,https://n.news.naver.com/mnews/article/609/0000614873?sid=106,"Fri, 12 Aug 2022 18:28:00 +0900"
240,[송기원 칼럼] 반지하 폭우 피해를 보는 시선,AFP 통신은 가수 <b>싸이</b>의 노래 &apos;강남 스타일&apos;로 알려진 강남에서 큰 피해가 발생했다고 전했다. 로이터 통신은 &apos;분리된 세상&apos; 이라는 기사 제목 아래 &quot;폭우가 서울의 심각한 불평등을 수면 위로 드러냈다&quot;고 보도했다.... ,https://www.goodnews1.com/news/articleView.html?idxno=411566,https://www.goodnews1.com/news/articleView.html?idxno=411566,"Fri, 12 Aug 2022 18:20:00 +0900"
241,위중증 환자 102일 만에 최고…먹는 치료제 처방 늘린다,가수 <b>싸이</b>가 지난 6일 여수에서 흠뻑쇼라는 대형 콘서트를 진행했는데요. 이후 이 공연을 관람한 66명의 시민이 확진 판정을 받으면서 공연 때문이 아니냐는 지적이 일기도 했습니다. 정부는 이 공연과 집단감염과... ,https://biz.sbs.co.kr/article_hub/20000076165?division=NAVER,https://n.news.naver.com/mnews/article/374/0000298746?sid=101,"Fri, 12 Aug 2022 18:17:00 +0900"
242,싸이·유재석→아이유·박재범…폭우 피해에 기부한 스타들 '선한 영향력'[종...,"<b>싸이</b>, 유재석, 수지, 아이유, 박재범, 김혜수 등은 최근 집중호우 피해 지역 복구와 이재민 구호 활동 지원을 위한 성금 1억 원을 기부했다. 먼저 <b>싸이</b>는 대한적십자사를 통해 &quot;갑작스러운 폭우로 삶의 터전을 잃은... ",https://www.spotvnews.co.kr/news/articleView.html?idxno=542544,https://n.news.naver.com/mnews/article/477/0000375996?sid=106,"Fri, 12 Aug 2022 18:16:00 +0900"
243,"대구도시철도, '싸이 흠뻑쇼' 특별 수송책 마련",대구도시철도공사가 &apos;<b>싸이</b> 흠뻑쇼&apos; 대구 공연이 열리는 8월 13일과 14일 밤늦게 귀가하는 시민을 위한 특별수송대책을 마련했습니다. 공사는 공연 관람 예상 인원이 하루 2만 5천 명 정도로 추정된다며 행사가... ,https://dgmbc.com/article/RFDDFAw8cLSZ,https://n.news.naver.com/mnews/article/657/0000005774?sid=102,"Fri, 12 Aug 2022 18:00:00 +0900"
244,115년만 역대급 폭우 피해 속출…줄 잇는 '도움의 손길',"방송인 유재석과 가수 겸 배우 수지도 전국재해구호협회에 각각 1억원씩 기부했고, 가수 <b>싸이</b>는 대한적십자사에 1억원을 전달했다. 이 외에도 배우 김고은과 그룹 위너의 강승윤이 각각 5000만원, 배우 강태오와 그룹... ",http://www.iminju.net/news/articleView.html?idxno=80052,http://www.iminju.net/news/articleView.html?idxno=80052,"Fri, 12 Aug 2022 17:56:00 +0900"
245,코로나 먹는 치료제 처방 확대...싸이 '흠뻑쇼' 등 대규모 공연 '현장점검' 실...,"▲출처: <b>싸이</b> 인스타그램 앞으로 고령층 등 신종 코로나바이러스 감염증(코로나19) 고위험군은 진료를 우선... 한편, <b>싸이</b> &apos;흠뻑쇼&apos;를 포함한 최근 대규모 공연 이후 신종 코로나바이러스 감염증(코로나19)이 확산함에 따라... ",https://www.thedrive.co.kr/news/newsview.php?ncode=1065602906236758,https://www.thedrive.co.kr/news/newsview.php?ncode=1065602906236758,"Fri, 12 Aug 2022 17:52:00 +0900"
246,"이대형X채태인, '문센맨'으로 뭉쳤다! 야구선수→예능 천재로 변신","K-pop 댄스 클래스를 통해 <b>싸이</b>의 ‘That That’ 안무를 배우고, 쿠킹클래스에서는 생전 처음 프랑스 고급 요리에 도전해 숨겨왔던 요리 실력을 보여줬다. 쓰레기를 주우며 등산을 하는 ‘플로깅’에 도전해 MZ세대의 새로운... ",http://www.sportsseoul.com/news/read/1150427?ref=naver,https://n.news.naver.com/mnews/article/468/0000873323?sid=106,"Fri, 12 Aug 2022 17:47:00 +0900"
247,"방역당국, 대형 공연장 방역관리 강화…9월까지 현장점검",최근 여수에선 3만 명이 몰린 가수 <b>싸이</b> 흠뻑쇼를 관람한 사람 중 66명이 무더기 확진 판정을 받았습니다. 방역당국은 다만 확진자들과 콘서트와의 감염 연관성은 아직 확인되지 않았다고 설명했습니다. #대규모공연장... ,http://www.yonhapnewstv.co.kr/MYH20220812017500038/?input=1825m,https://n.news.naver.com/mnews/article/422/0000555595?sid=101,"Fri, 12 Aug 2022 17:37:00 +0900"
248,광복절 연휴는 '서울페스타'와 함께…도심 곳곳 공연·행사 '축제의 향연',&apos;2022 서울페스타&apos;는 지난 10일 서울 잠실종합운동장 올림픽주경기장에서 <b>싸이</b>·비·엔하이픈 등이 출연하는 K팝 공연 &apos;K-POP SUPER LIVE&apos;로 첫 포문을 열었다. &apos;2022 서울페스타&apos;는 코로나19로 침체된 서울관광 회복의 신호탄... ,http://www.starnewsk.com/news/articleView.html?idxno=32588,http://www.starnewsk.com/news/articleView.html?idxno=32588,"Fri, 12 Aug 2022 17:34:00 +0900"
249,"[와이티엔 스타뉴스] 김혜수→유재석, 폭우 피해에 이어지는 기부 물결",가수 <b>싸이</b> 씨 역시 중부지방 집중호우 피해지역 이재민 구호활동 지원을 위해 성금 1억 원을 적십자사에 기탁했다. <b>싸이</b> 씨는 &quot;갑작스러운 폭우로 삶의 터전을 잃은 이웃들의 아픔을 함께 나누고 피해지역 복구 활동에... ,https://star.ytn.co.kr/_sn/0117_202208121721477775,https://n.news.naver.com/mnews/article/052/0001776207?sid=106,"Fri, 12 Aug 2022 17:21:00 +0900"
250,(영상) ‘폭우 피해’에 줄 잇는 연예계 억대 기부금,가수 <b>싸이</b> 역시 중부지방 집중호우 피해 이재민 구호활동 지원을 위해 성금 1억 원을 대한적십자사에 기탁했다. <b>싸이</b>는 갑작스러운 폭우로 삶의 터전을 잃은 이웃들의 아픔을 함께 나누고 피해지역 복구 활동에... ,http://www.newstomato.com/ReadNews.aspx?no=1140957&inflow=N,http://www.newstomato.com/ReadNews.aspx?no=1140957&inflow=N,"Fri, 12 Aug 2022 17:18:00 +0900"
251,"싸이 '흠뻑쇼' 확진자 속출…정부 ""9월까지 대규모 공연 현장점검""",가수 <b>싸이</b>의 &apos;흠뻑쇼&apos;를 비롯해 대규모 공연에 참석한 뒤 코로나19에 확진된 사례가 잇따르자 정부가 9월까지... 지난 6일 전라남도 여수에서 열린 <b>싸이</b>의 &apos;흠뻑쇼&apos;를 보고온 여수 시민 77명이 현재까지 확진 판정을 받기도... ,http://news.mt.co.kr/mtview.php?no=2022081216590580874,https://n.news.naver.com/mnews/article/008/0004782637?sid=102,"Fri, 12 Aug 2022 17:09:00 +0900"
252,"싸이월드, ‘동대문 Y2K 갬성 페스티벌’ 후원사 참여", <b>싸이</b>월드는 동대문 패션타운 관광특구 축제인 ‘동대문 Y2K 갬성 페스티벌’에 후원사로 참여한다고 12일... ▲ <b>싸이</b>월드가 ‘동대문 Y2K 갬성 페스티벌’에 후원사로 참여한다. [사진=<b>싸이</b>월드] 이번 행사에서는... ,https://hobbyen.co.kr/news/newsview.php?ncode=1065594082759450,https://hobbyen.co.kr/news/newsview.php?ncode=1065594082759450,"Fri, 12 Aug 2022 17:02:00 +0900"
253,"신한금융, '배달시장' 정조준... 비금융 서비스 다각화","신한銀 땡겨요, <b>싸이</b> 앞세운 광고 효과 &apos;톡톡&apos; 신한라이프, 배달종사자 맞춤 보험 개발 박차 그룹 차원... 12일 업계에 따르면 최근 신한은행의 배달앱 &apos;땡겨요&apos;는 본격적인 서비스 확장에 맞춰 유명스타 <b>싸이</b>를 앞세운 광고... ",http://www.meconomynews.com/news/articleView.html?idxno=69613,http://www.meconomynews.com/news/articleView.html?idxno=69613,"Fri, 12 Aug 2022 17:02:00 +0900"
254,'거제맥주축제' 3년 만에 열린다…17∼20일 장승포 수변공원,"18·19일은 <b>싸이</b>버그가 무대에 선다. 또 아름다운 장승포항 배경뿐만 아니라 올라호프(8월의 크리스마스 콘셉트), 레드카펫존, 테라병에어벌룬 등 다양한 포토존도 마련돼 있다. 침체된 지역상권을 위해 장승포차... ",http://www.queen.co.kr/news/articleView.html?idxno=379665,http://www.queen.co.kr/news/articleView.html?idxno=379665,"Fri, 12 Aug 2022 17:02:00 +0900"
255,"위중증 환자 102일 만에 최다...""먹는 치료제 처방 확대""","재택치료환자가 70만 명에 육박함에 따라 해열제와 감기약 등 약품 공급 대책을 추가하고 &apos;<b>싸이</b> 흠뻑쇼&apos; 방문 뒤 확진이 잇따르자 대형 공연장의 경우, 9월까지 현장점검을 하는 등 방역 관리를 강화하기로 했습니다.... ",https://www.ytn.co.kr/_ln/0103_202208121658372337,https://n.news.naver.com/mnews/article/052/0001776191?sid=102,"Fri, 12 Aug 2022 16:58:00 +0900"
256,싸이 ‘흠뻑쇼’등 대규모 공연 후 무더기 확진...9월까지 현장점검 강화,"한편 지난 6일, 3만 명이 몰렸던 <b>싸이</b> 여수 ‘흠뻑쇼’를 다녀간 관람객 66명이 코로나19에 확진됐습니다. 박향 중앙사고수습본부 방역총괄반장은 실내뿐 아니라 실외 공연에서도 규모가 50명 이상이면 꼭 마스크를 착용해... ",https://www.cjb.co.kr/home/sub.php?menukey=61&mod=view&P_NO=220812513&PRO_CODE=99,https://n.news.naver.com/mnews/article/655/0000003828?sid=102,"Fri, 12 Aug 2022 16:55:00 +0900"
257,"진옥동 신한은행 호실적에 잇단 성과로 입지 다져, 이상 외환거래는 부담",땡겨요는 진 행장이 올해 초 신사업으로 야심차게 내놓은 배달앱으로 최근에는 가수 <b>싸이</b>씨를 모델로 기용해 경쟁업체인 &apos;배달의민족&apos;을 저격하는 듯한 TV광고를 내보내기도 해 시장에서 큰 관심을 받고 있다. 진 행장이... ,https://www.businesspost.co.kr/BP?command=article_view&num=289806,https://www.businesspost.co.kr/BP?command=article_view&num=289806,"Fri, 12 Aug 2022 16:50:00 +0900"
258,"먹는 치료제 처방 확대…대구시, 주말 '싸이 흠뻑쇼' 예의주시",이틀 간 대구스타디움 주경기장에서 열리는 가수 <b>싸이</b>의 &apos;흠뻑쇼&apos; 콘서트에는 6만 4천여 명의 인파가 몰릴 전망이다. 해당 콘서트는 공연 내내 수백 톤(t)의 물을 뿌리는 공연 특성 상 감염 전파 가능성이 높다는 우려가... ,https://news.imaeil.com/page/view/2022081215170927229,https://n.news.naver.com/mnews/article/088/0000770629?sid=102,"Fri, 12 Aug 2022 16:43:00 +0900"
259,"싸이 콘서트 '흠뻑쇼' 관객 코로나19 줄확진…""오는 9월까지 현장 점검""",사진 = 연합뉴스 최근 사회적 거리두기가 해제됨에 따라 <b>싸이</b> 콘서트 &apos;흠뻑쇼&apos;와 같은 대규모 공연 및 페스티벌에 갔다 온 뒤 코로나19에 확진된 사람이 속출하고 있다. 이에 중앙재난안전대책본부는 12일... ,https://www.gokorea.kr/news/articleView.html?idxno=728168,https://www.gokorea.kr/news/articleView.html?idxno=728168,"Fri, 12 Aug 2022 16:30:00 +0900"
260,"싸이 '흠뻑쇼' 관람 확진자 속출에, 정부 ""콘서트 현장 점검""",뉴스토마토 = 박재연 기자 | 17일 오후 서울 송파구 잠실 올림픽주경기장에서 열리는 가수 <b>싸이</b>의 콘서트 &apos;<b>싸이</b>흠뻑쇼 2022&apos;를 찾은 관객들이 입장을 기다리고 있다. 2022.7.17 최근 가수 <b>싸이</b>의 &apos;흠뻑쇼&apos; 공연을 관람한... ,http://www.newstomato.com/ReadNews.aspx?no=1140904&inflow=N,http://www.newstomato.com/ReadNews.aspx?no=1140904&inflow=N,"Fri, 12 Aug 2022 16:20:00 +0900"
261,"'흠뻑쇼' 관객들 줄확진…""대규모 공연 9월까지 현장 점검""",최근 <b>싸이</b> 콘서트 &apos;흠뻑쇼&apos;와 같은 대규모 공연에 갔다온 뒤 신종 코로나바이러스 감염증(코로나19)에... 최근 <b>싸이</b>의 콘서트 &apos;흠뻑쇼&apos; 여수 공연을 관람한 이 중 66명이 무더기 확진 판정을 받았다. 다만 확진된 이들과... ,https://www.hankyung.com/society/article/2022081203817,https://n.news.naver.com/mnews/article/015/0004736375?sid=102,"Fri, 12 Aug 2022 16:18:00 +0900"
262,마음은 더 예쁩니다...아이유·수지 수해복구 성금 각 1억 기부,"방송인 유재석, 가수 <b>싸이</b>(본명 박재상), 배우 김혜수가 1억원 씩을 기부했으며 배우 김고은, 한지민이 5000만원 씩 기부했다. 갓세븐 멤버 겸 배우 박진영과 가수 겸 방송인 이미주는 3000만원을 전달했다. 또 영화... ",http://star.mk.co.kr/new/view.php?mc=ST&year=2022&no=714440,https://n.news.naver.com/mnews/article/009/0005003878?sid=102,"Fri, 12 Aug 2022 16:14:00 +0900"
263,'거제맥주축제' 3년 만에 개최…17∼20일 장승포 수변공원,"18·19일은 <b>싸이</b>버그가 무대에 선다. 또 아름다운 장승포항 배경뿐만 아니라 올라호프(8월의 크리스마스 콘셉트), 레드카펫존, 테라병에어벌룬 등 다양한 포토존도 마련돼 있다. 침체된 지역상권을 위해 장승포차... ",https://www.news1.kr/articles/4771807,https://n.news.naver.com/mnews/article/421/0006275433?sid=102,"Fri, 12 Aug 2022 16:11:00 +0900"
264,"정부 ""대형 공연장 관리 강화""…'흠뻑쇼' 우려에 방역 '고삐'",가수 <b>싸이</b>의 &apos;흠뻑쇼&apos;로 인한 감염 확산 우려가 커진 데 따른 조치로 해석됩니다. 중앙재난안전대책본부는... 논란이 되는 <b>싸이</b>의 &apos;흠뻑쇼&apos;는 공연 개최가 확정됐을 때부터 우려의 목소리가 나왔습니다. 대규모의 관객들이... ,http://mbn.mk.co.kr/pages/news/newsView.php?category=mbn00009&news_seq_no=4822887,https://n.news.naver.com/mnews/article/057/0001683244?sid=102,"Fri, 12 Aug 2022 16:01:00 +0900"
265,"MLB 레전드 9월 한국 온다, KBO 전설 4명과 '홈런포 대결'","특히 경기 이후 현장에서는 <b>싸이</b>, 크러쉬, 헤이즈가 공연하는 K-POP 페스티벌이 열릴 계획이어서 현장을 찾는 관람객들에게 야구를 통한 다양한 즐거움을 제공할 예정이다. ━ ◆ FTX MLB Home Run Derby X Seoul 참가 팀... ",http://star.mt.co.kr/stview.php?no=2022081215452472109,https://sports.news.naver.com/news.nhn?oid=108&aid=0003078506,"Fri, 12 Aug 2022 16:00:00 +0900"
266,"""화려한 존재감 보여줄 것""… 나폴리 주장, 김민재 극찬",지난달 페네르바체(튀르키예)에서 나폴리로 이적한 김민재는 입단 직후 동료들 앞에서 <b>싸이</b>의 &apos;강남스타일&apos;을 선보이는 등 빠르게 적응하고 있다. 팀 동료 스타니슬라우 로보트카(27)도 이날 현지 매체 키스키스... ,http://moneys.mt.co.kr/news/mwView.php?no=2022081215213062551,https://sports.news.naver.com/news.nhn?oid=417&aid=0000842460,"Fri, 12 Aug 2022 15:55:00 +0900"
267,"“수지, 아이유, 이미주...” 이어지는 수해피해 기부 행렬 (종합)","가수 <b>싸이</b>도 이날 중부지방 집중호우 피해지역 이재민 구호활동 지원을 위한 성금 1억원을 적십자사에 기부했다. 이외에도 배우 김고은, 배우 강태오, 개그맨 박나래, 오마이걸 맴버 아린, 배우 홍수현, 배우 임시완 등이... ",http://www.fnnews.com/news/202208121539355850,https://n.news.naver.com/mnews/article/014/0004882532?sid=103,"Fri, 12 Aug 2022 15:42:00 +0900"
268,"‘흠뻑쇼’ 뒤 지역 확진자 폭증… 정부, 현장 점검 나서",가수 <b>싸이</b> ‘흠뻑쇼’를 비롯한 대규모 공연이 코로나19 감염 확산의 매개체로 작용하고 있다는 비판이 제기되자 정부가 현장 관리를 강화하기로 했다. 9월 말까지 개최되는 대형 콘서트와 페스티벌을 대상으로... ,https://news.kmib.co.kr/article/view.asp?arcid=0017368601&code=61121111&cp=nv,https://n.news.naver.com/mnews/article/005/0001546144?sid=102,"Fri, 12 Aug 2022 15:33:00 +0900"
269,"코로나 확진자 증가 폭 둔화...고위험군, 원스톱진료기관 우선 진료","재택치료환자가 70만 명에 육박함에 따라 해열제와 감기약 등 약품 공급 대책을 추가하고 &apos;<b>싸이</b> 흠뻑쇼&apos; 방문 뒤 확진이 잇따르자 대형 공연장의 경우, 9월까지 현장점검을 하는 등 방역 관리를 강화하기로 했습니다.... ",https://www.ytn.co.kr/_ln/0103_202208121520353605,https://n.news.naver.com/mnews/article/052/0001776131?sid=102,"Fri, 12 Aug 2022 15:20:00 +0900"
270,‘흠뻑쇼’ 다녀온 관람객 줄줄이 확진…내일부터 대구에서 또 열린다,가수 <b>싸이</b>의 ‘흠뻑쇼’를 비롯해 대규모 공연에 참석한 뒤 코로나에 확진됐다는 사례가 잇따르자 정부가... 그러나 최근 온라인상에는 <b>싸이</b>의 ‘흠뻑쇼’에 다녀온 뒤 코로나에 확진됐다는 후기가 쏟아졌다. 특히 지난달... ,https://www.chosun.com/national/national_general/2022/08/12/V3CUKHODEBGQRBPIOBG4D5UIQY/?utm_source=naver&utm_medium=referral&utm_campaign=naver-news,https://n.news.naver.com/mnews/article/023/0003709612?sid=102,"Fri, 12 Aug 2022 15:10:00 +0900"
271,"나폴리 주장 ""김민재 필드 위에서 인정받을 것""","이후 <b>싸이</b>의 강남스타일을 열창하는 신고식 영상이 소셜미디어를 통해 소개돼 화제를 불러 모았고, 친선경기에 출장해 동료들과 호흡을 맞추고 있다. 디로렌초는 &quot;춤추는 영상이 화제가 됐다&quot;며 &quot;크게 주목을 받으며... ",https://isplus.com/2022/08/12/sports/football/20220812150611022.html,https://sports.news.naver.com/news.nhn?oid=241&aid=0003224900,"Fri, 12 Aug 2022 15:06:00 +0900"
272,이주노동자 안전 도마위… 인천서 상반기 사망사고 잇따라,3월에도 인천 중구 을왕동에서 일하던 중국인 노동자 40대 C씨가 떨어지는 철근에 맞아 사망하는 등 올해 인천에서 이주노동자 사망사고가 연이어 발생하고 있다.최근에는 강원도 강릉에서 열린 인기 가수 <b>싸이</b>의 흠뻑쇼... ,http://www.kyeongin.com/main/view.php?key=20220809010001692,http://www.kyeongin.com/main/view.php?key=20220809010001692,"Fri, 12 Aug 2022 15:06:00 +0900"
273,스타들의 기부 릴레이!,"<b>싸이</b>도 1억원을 기부, 집중호우 피해가 발생한 지역의 긴급 구호활동을 지원합니다. &quot;갑작스러운 폭우로... 생활에 어려움을 겪고 있는 이재민들이 하루빨리 일상을 회복할 수 있기를 바란다&quot; <b>싸이</b>는 앞서 2019년 강원도... ",https://www.marieclairekorea.com/celebrity/2022/08/star-donation/?utm_source=naver&utm_medium=partnership,https://www.marieclairekorea.com/celebrity/2022/08/star-donation/?utm_source=naver&utm_medium=partnership,"Fri, 12 Aug 2022 15:04:00 +0900"
274,"""1억원 쾌척?""… 연예계 기부천사, 돈보다 값진 마음씨",가수 <b>싸이</b>는 대한적십자사에 1억원의 기부금을 내놨다. 적십자사에 따르면 <b>싸이</b>는 &quot;갑작스러운 폭우로 삶의 터전을 잃은 이웃들의 아픔을 함께 나누고 피해지역 복구 활동에 조금이나마 도움이 되고자 기부하게 됐다&quot;며... ,http://moneys.mt.co.kr/news/mwView.php?no=2022081214105560003,https://n.news.naver.com/mnews/article/417/0000842441?sid=106,"Fri, 12 Aug 2022 15:02:00 +0900"
275,싸이 '흠뻑쇼' 확진자 속출‥대형 공연장 방역관리 강화한다,가수 <b>싸이</b>의 &apos;흠뻑쇼&apos;와 같은 대규모 공연장에서 코로나19 감염 확산 가능성이 제기되면서 정부가 다음... 최근 3만 명이 몰렸던 여수의 <b>싸이</b> &apos;흠뻑쇼&apos;를 관람한 사람들 가운데 66명이 무더기로 확진 판정을 받으며... ,https://imnews.imbc.com/news/2022/society/article/6397680_35673.html,https://n.news.naver.com/mnews/article/214/0001215404?sid=102,"Fri, 12 Aug 2022 14:47:00 +0900"
276,"싸이 '흠뻑쇼' 공연 후 줄줄이 확진…정부 ""콘서트 현장 점검""",가수 <b>싸이</b>의 &apos;흠뻑쇼&apos;를 비롯해 대규모 공연에 참석한 뒤 코로나19에 확진된 사례가 이어지자 정부가 현장... 지난 6일 전라남도 여수에서 열린 <b>싸이</b>의 흠뻑쇼를 관람한 여수 시민 77명이 확진 판정을 받기도 했다. 이에... ,https://www.sedaily.com/NewsView/269RQ28P6N,https://n.news.naver.com/mnews/article/011/0004087117?sid=102,"Fri, 12 Aug 2022 14:42:00 +0900"
277,싸이 '흠뻑쇼' 등 대형 공연장 방역관리 강화,최근 3만명이 몰렸던 여수의 <b>싸이</b>의 흠뻑쇼를 관람한 사람 중 66명이 코로나19 확진 판정을 무더기로 받으면서 방역당국은 긴장을 늦추지 못하고 있다. 다만 확진된 이들과 흠뻑쇼와의 감염 연관성은 아직 확인되지... ,http://news.tvchosun.com/site/data/html_dir/2022/08/12/2022081290140.html,https://n.news.naver.com/mnews/article/448/0000369623?sid=102,"Fri, 12 Aug 2022 14:28:00 +0900"
278,"싸이 ‘흠뻑쇼’ 관람 후 무더기 확진...""9월까지 대형공연 현장점검""",최근 가수 <b>싸이</b>의 ‘흠뻑쇼’ 등 대규모 공연 관람 뒤 코로나19에 확진됐다는 후기가 잇따르자 정부가 다음 달까지 현장 관리를 강화하기로 했다. 중앙재난안전대책본부는 12일 문화체육관광부로부터 대규모 공연장... ,http://star.mk.co.kr/new/view.php?mc=ST&year=2022&no=713603,https://n.news.naver.com/mnews/article/009/0005003829?sid=102,"Fri, 12 Aug 2022 14:26:00 +0900"
279,아이유 수해 성금 1억 기부...수지·유재석·김혜수 등 선한영향력 행사,"이번 수해 복구 관련 기부에는 아이유, 수지 뿐만 아니라 방송인 유재석, 가수 <b>싸이</b>, 배우 김고은, 한지민, 김혜수, 갓세븐 멤버 겸 배우 박진영, 임시완, 윤세아, 박나래, 오마이걸 아린 등이 참여했다. 한편 아이유는... ",https://www.sisamagazine.co.kr/news/articleView.html?idxno=458748,https://www.sisamagazine.co.kr/news/articleView.html?idxno=458748,"Fri, 12 Aug 2022 14:16:00 +0900"
280,"'안나' 종영 이후 잠잠했던 수지, 모두가 머리 쓰다듬어줄 소식 전했다","방송인 유재석과 가수 <b>싸이</b>도 각 1억 원씩 거금을 쾌척했다. 수해 복구 위해 유재석이 뒤에서 조용히 한 일... 많았던 <b>싸이</b>, 11일 정말 기분 좋은 소식 전했다 &apos;흠뻑쇼&apos; 전국투어 중인 <b>싸이</b>,대한적십자사 통해 1억 기부.... ",https://www.wikitree.co.kr/articles/780139,https://www.wikitree.co.kr/articles/780139,"Fri, 12 Aug 2022 14:16:00 +0900"
281,"수지-아이유, 수해 복구 성금 각각 1억 원씩 기부","한편, 아이유와 수지 외에도 많은 스타들이 이재민을 위한 기부 행렬에 동참하고 있다. 김혜수, 유재석, <b>싸이</b>, 김고은, 한지민 등 스타들이 여러 재단과 기관에 통해 성금을 전달했다. 박설이 기자 /",https://www.tvreport.co.kr/2112298,https://n.news.naver.com/mnews/article/213/0001225525?sid=106,"Fri, 12 Aug 2022 14:06:00 +0900"
282,대규모 콘서트.축제 방역관리 강화…9월까지 현장점검,가수 <b>싸이</b> `흠뻑쇼` 같은 대규모 공연장에서 코로나19 감염 확산 가능성이 제기됨에 따라 정부가 다음 달까지... 최근 3만 명이 몰렸던 <b>싸이</b>의 전남 여수 흠뻑쇼를 관람한 사람 중 66명이 코로나19 확진 판정을 받아... ,http://tbs.seoul.kr/news/newsView.do?typ_800=6&idx_800=3475914&seq_800=20468580,http://tbs.seoul.kr/news/newsView.do?typ_800=6&idx_800=3475914&seq_800=20468580,"Fri, 12 Aug 2022 14:02:00 +0900"
283,"아이유·수지, 수해 피해 이재민 위해 1억 원씩 기부","이들 외에도 여러 연예인들이 기부 행렬을 이어가고 있다. 앞서 가수 <b>싸이</b>, 방송인 유재석, 배우 김혜수 등도 폭우 피해 복구를 위해 각 1억 원씩 기부했으며, 배우 김고은, 한지민 등도 5000만 원을 기부했다.",https://www.etoday.co.kr/news/view/2163224,https://www.etoday.co.kr/news/view/2163224,"Fri, 12 Aug 2022 13:54:00 +0900"
